,Investigator On
0,CITY Health - Center for Study of Community Health  awarded by  National Center for Chronic Disease Prevention & Health Promo./CDC/DHHS
1,CITY Health - Center for Study of Community Health SIP 11-042: Patient Preferences and Needs in Ovarian Cancer Care  awarded by  National Center for Chronic Disease Prevention & Health Promo./CDC/DHHS
2,Coronary Artery Risk Development In Young Adults (CARDIA) Study-Coordinating Center  awarded by  NIH - National Institutes of Health/DHHS
3,Coronary Artery Risk Development In Young Adults (CARDIA) Study-Coordinating Center  awarded by  NIH - National Institutes of Health/DHHS
4,"Coronary Artery Risk Development in Young Adults (CARDIA) Study - Coordinating Center  awarded by  National Heart, Lung, and Blood Institute/NIH/DHHS"
5,"Longitudinal Studies of Coronary Heart Disease Risk Factors in Young Adults (CARDIA) - Coordinating Center  awarded by  National Heart, Lung, and Blood Institute/NIH/DHHS"
6,Quality of Epilepsy Treatment and Costs in Older Americans by Race (QUIET CARE)  awarded by  National Institute of Neurological Disorders and Stroke/NIH/DHHS
