,Investigator On
0,Dermal NF Biobank Award  awarded by  Children's Tumor Foundation
1,Hepato/Renal Fibrocystic Diseases Core Center (UAB HRFDCC)  awarded by  National Institute of Diabetes and Digestive and Kidney Diseases/NIH/DHHS
2,Hepato/Renal Fibrocystic Diseases Core Center (UAB HRFDCC) - Core A  awarded by  National Institute of Diabetes and Digestive and Kidney Diseases/NIH/DHHS
3,UAB Mental Retardation Research Center  awarded by  National Institute of Child Health and Human Development/NIH/DHHS
4,UAB Mental Retardation Research Center - Core D  awarded by  National Institute of Child Health and Human Development/NIH/DHHS
