,Education And Training
0,"Doctor of Philosophy in Nursing Science,  Yale University   2014"
1,"Master of Nursing in Psychiatric / Mental Health Nurse / Nursing,  Yale University   2009"
2,"Master of Public Health in Family and Community Services,  Harvard University   2006"
3,"Master of Education in Psychology,  Harvard University   1997"
4,"Master of Arts in Development Economics and International Development,  American University   1995"
5,"Bachelor of Arts in Political Science and Government,  University of Delaware   1989"
